order_id,customer_id,date,nearest_warehouse,shopping_cart,order_price,delivery_charges,customer_lat,customer_long,coupon_discount,order_total,season,is_expedited_delivery,distance_to_nearest_warehouse,latest_customer_review,is_happy_customer
ORD013868,ID0052599802,2019-06-25,Thompson,"[('Universe Note', 2), ('Olivia x460', 1)]",8125,66.17,-37.8043805,144.9523199,25,6159.92,Winter,False,1.0322,the new one works great seller did me right. bought two. one worked well and the other didn't. but the seller replaced it. the new one works great,True
ORD261094,ID2834982472,2019-08-31,Bakers,"[('pearTV', 2), ('iAssist Line', 1), ('Olivia x460', 1)]",16070,70.28,-37.8121739,145.014645,5,15336.78,Winter,False,1.7244,working great. purchased for a friend. working great.,True
ORD014923,ID2190483584,2019-06-30,Thompson,"[('Universe Note', 2), ('iStream', 2), ('Olivia x460', 1)]",8425,67.79,-37.809257,144.9607912,25,6386.54,Winter,False,1.2653,four stars very good,True
ORD442763,ID2180785597,2019-08-21,Nickolson,"[('Thunder line', 2), ('iStream', 2), ('Olivia x460', 1), ('Candle Inferno', 2)]",6745,63.9,-37.8169685,144.961547,0,6808.9,Winter,False,0.7268,smartphones yes this phone is great really smooth... thanks digico and by extension wireless hub... really great service and really nice and new products no second hand stuff...,True
ORD141764,ID0370750714,2019-06-23,Bakers,"[('pearTV', 2), ('Lucent 330S', 2), ('Thunder line', 2), ('Olivia x460', 1)]",20665,63.7,-37.812248600000004,144.9884905,25,15562.45,Winter,False,0.6437,love it! works great! the phone performance and system are awesome. i would definitely recommend to anyone.,True
ORD240586,ID2353534942,2019-07-18,Thompson,"[('pearTV', 1), ('Thunder line', 2)]",10670,72.59,-37.799821,144.9630497,15,9142.09,Winter,False,2.0056,easy to use!,True
ORD215417,ID6147536420,2019-07-09,Thompson,"[('iAssist Line', 2), ('Universe Note', 1), ('Lucent 330S', 1)]",9130,68.92,-37.821451700000004,144.93409619999997,15,7829.42,Winter,False,1.5021,the phone is almost like new! the phone works great!!!!,True
ORD176321,ID6167489433,2019-06-11,Thompson,"[('Lucent 330S', 2), ('Olivia x460', 1)]",3685,66.53,-37.8120309,144.9595061,10,3383.03,Winter,False,1.0961,worth it charger problem but overall is good,True
ORD128514,ID1458418063,2019-07-04,Bakers,"[('Alcon 10', 1), ('iStream', 1)]",9100,70.47,-37.8199973,145.0108301,10,8260.47,Winter,False,1.7666,excellent but doesn't accept a verizon sim card i absolutely loved this phone but had no idea that a verizon sim card would not work for it. i had no signal in my area.,True
ORD132759,ID0332544860,2019-06-14,Thompson,"[('iStream', 1), ('Candle Inferno', 1)]",580,62.37,-37.8110223,144.9505115,0,642.37,Winter,False,0.3542,great phone!!! great purchase,True
ORD339522,ID3555805915,2019-07-29,Thompson,"[('Universe Note', 2), ('Olivia x460', 2), ('Candle Inferno', 1), ('Thunder line', 2)]",14140,65.49,-37.8050924,144.93696740000001,10,12791.49,Winter,False,1.2253,does everything i needed and morei use it as a travel companion and the size is great.,True
ORD488968,ID0361227898,2019-08-16,Bakers,"[('iAssist Line', 1), ('Toshika 750', 2)]",10865,70.81,-37.8018159,144.9763155,10,9849.31,Winter,False,1.8966,five stars everything great.... thanks,True
ORD348123,ID0589397642,2019-07-31,Nickolson,"[('Thunder line', 1), ('iAssist Line', 1)]",4405,65.34,-37.8123879,144.97384069999995,10,4029.84,Winter,False,0.7872,for the price this is an excellent size screen i have no complaints. for the price this is an excellent size screen. it's fast and has great reception in areas where others don't.,True
ORD060064,ID0711331316,2019-08-17,Thompson,"[('Lucent 330S', 2), ('pearTV', 2), ('iAssist Line', 1), ('Olivia x460', 1)]",18530,68.01,-37.80679779999999,144.9571225,0,18598.01,Winter,False,1.0998,five stars overall a great phone,True
ORD446828,ID0580186485,2019-08-25,Thompson,"[('Alcon 10', 1), ('iStream', 1), ('pearTV', 2)]",21720,74.52,-37.79965900000001,144.9248126,5,20708.52,Winter,False,2.4352,five stars awesome!,True
ORD043879,ID0121159757,2019-06-18,Thompson,"[('Olivia x460', 1), ('iStream', 1), ('Alcon 10', 2), ('Lucent 330S', 1)]",20505,66.88,-37.8102648,144.95965990000005,15,17496.13,Winter,False,1.1393,i love it it’s very good i sent it as a gift internationally and working great,True
ORD146050,ID6167489409,2019-07-14,Thompson,"[('Alcon 10', 1), ('Thunder line', 2), ('iStream', 1)]",13460,67.7,-37.8099973,144.9582524,15,11508.7,Winter,False,1.0276,"love the product. i use it every day for web,games and reading.",True
ORD359161,ID0579408548,2019-08-04,Nickolson,"[('Olivia x460', 2), ('pearTV', 1), ('Candle Inferno', 1), ('iAssist Line', 2)]",13640,60.24,-37.8210611,144.9687644,10,12336.24,Winter,False,0.2831,five stars excellent!!,True
ORD332153,ID4883391027,2019-07-10,Bakers,"[('Candle Inferno', 2), ('iAssist Line', 1), ('Lucent 330S', 1)]",4315,70.77,-37.8195648,145.01410019999997,0,4385.77,Winter,False,1.9717,"value for your buck it's a very nice phone,works fast, very nice screen resolution and the camera is good for the price...... the only problem is the battery, for the size i don't think it last long enough.",True
ORD253859,ID1982309205,2019-06-25,Bakers,"[('iStream', 2), ('Alcon 10', 2), ('Candle Inferno', 1)]",18630,65.45,-37.800964,144.99097890000004,5,17763.95,Winter,False,1.0728,five stars excellent!,True
ORD316107,ID1889197942,2019-08-08,Thompson,"[('Olivia x460', 2), ('Toshika 750', 1)]",6770,67.45,-37.80588,144.95598999999999,10,6160.45,Winter,False,1.0897,"good xp for this price! pure android, no junk! my phone is dual sim, but the tray was wrong. apparently xp made mistake constructing some number of phones and placed single sim tray into two-sim phone. had to contact their support for repair/replacement.",True
ORD401806,ID1449295048,2019-06-14,Nickolson,"[('pearTV', 1), ('Alcon 10', 1)]",15260,66.6,-37.8165922,144.98264619999995,10,13800.6,Winter,False,1.1729,excellent replacement phone this was a replacement phone and it was exactly what i expected. an excellent phone in excellent condition. no complaints.,True
ORD129148,ID2615820738,2019-07-28,Thompson,"[('Lucent 330S', 2), ('Universe Note', 1), ('Candle Inferno', 2), ('Alcon 10', 2)]",24670,67.58,-37.80620820000001,144.9584161,25,18570.08,Winter,False,1.2304,nice piece quality for less,True
ORD285990,ID6167489375,2019-08-17,Thompson,"[('Candle Inferno', 2), ('Toshika 750', 2), ('Olivia x460', 2)]",11950,67.41,-37.8076285,144.95817119999995,10,10822.41,Winter,False,1.1264,decent cheap large screen smartphone . great very inexpensive alternative for people that don't need cutting edge specs .,True
ORD240396,ID5680175257,2019-08-05,Bakers,"[('iStream', 2), ('Olivia x460', 2), ('Universe Note', 2), ('Candle Inferno', 1)]",10080,63.23,-37.8102365,144.98093590000005,5,9639.23,Winter,True,1.2576,one star rip off...beta phone,False
ORD335141,ID0227324737,2019-06-24,Bakers,"[('Alcon 10', 2), ('Lucent 330S', 1), ('pearTV', 2)]",31750,60.57,-37.8043117,144.99474850000001,0,31810.57,Winter,True,0.6342,"piece of crap had to send it back; consistently failed to notify me of phone calls, texts, etc.",False
ORD301346,ID0708721588,2019-06-07,Thompson,"[('Universe Note', 1), ('Candle Inferno', 2), ('Olivia x460', 2)]",6760,61.41,-37.8073688,144.9559065,5,6483.41,Winter,True,0.9761,"camera keeps crashing bought this refurbished phone a couple of days ago. the phone is ok, but the camera keeps crashing and all the solutions i tried failed. this is muy second pixel that has the same issue. do not recommend this phones.",False
ORD434822,ID3215106472,2019-08-12,Thompson,"[('Alcon 10', 2), ('Universe Note', 2)]",24800,57.65,-37.809963399999994,144.9520213,5,23617.65,Winter,True,0.5298,i would not give it one star but that's the ... i would not give it one star but that's the only way i can give a review olivia should be embarrassed for selling this phone,False
ORD396958,ID0710033525,2019-08-18,Thompson,"[('Toshika 750', 2), ('iStream', 1), ('Lucent 330S', 1)]",10020,62.92,-37.8157144,144.9381885,15,8579.92,Winter,True,0.8512,"i wouldn't buy this again. it's advertised as unlocked ... i wouldn't buy this again. it's advertised as unlocked, but when it arrived i found out too late that it was locked to at&t. so buyer beware on this one.",False
ORD035562,ID4069502043,2019-08-03,Bakers,"[('Toshika 750', 2), ('Candle Inferno', 2), ('Universe Note', 2)]",16400,62.62,-37.8172711,144.98782759999997,15,14002.62,Winter,True,1.0391,"devolución sin reembolso buenas tardes. el 27 de agosto se aprobó la devolución de este teléfono, sin embargo hasta la presente fecha ( 11 de octubre ) no se ha hthunder el reembolso en mi tarjeta de crédito. por favor su ayuda. saludos",False
ORD260259,ID3204395231,2019-06-08,Thompson,"[('iAssist Line', 2), ('iStream', 2)]",4750,60.12,-37.8075427,144.9479927,0,4810.12,Winter,True,0.5769,the alcon's water resistance rating is pure garbage. i just drowned two phones in an inch ... the alcon's water resistance rating is pure garbage. i just drowned two phones in an inch of water within a few minutes. anyone know of a class-action lawsuit for this?,False
ORD117128,ID6167489441,2019-06-24,Nickolson,"[('Candle Inferno', 2), ('pearTV', 2)]",13480,63.83,-37.812988399999995,144.95961200000005,25,10173.83,Winter,True,1.074,the candle inferno i purchased does not work. it does not start or charge.,False
ORD348943,ID4520380494,2019-08-30,Thompson,"[('iAssist Line', 1), ('Thunder line', 2), ('Universe Note', 1)]",10035,60.77,-37.8086109,144.955484,0,10095.77,Winter,True,0.8673,"the power charge plug can not use in north america, it is wrong charge north america power plug is flat edge, but the power charge plug is round",False
ORD274089,ID4315294436,2019-06-23,Thompson,"[('Lucent 330S', 2), ('Candle Inferno', 1), ('iAssist Line', 2)]",7340,62.0,-37.8171028,144.95334450000001,15,6301.0,Winter,True,0.7401,it was dirty inside screen was scratched very badly the phone had ... it was dirty inside screen was scratched very badly the phone had to be cleaned because it was terribly dirty.,False
ORD013756,ID0711333371,2019-08-22,Thompson,"[('Candle Inferno', 2), ('iAssist Line', 1), ('Olivia x460', 1)]",4310,61.1,-37.806793400000004,144.9559989,0,4371.1,Winter,True,1.0223,one star i am not happy with this phone. low battery quality.,False
ORD201866,ID0277363224,2019-06-18,Bakers,"[('Olivia x460', 1), ('iAssist Line', 2)]",5675,52.53,-37.810913299999996,145.00983280000003,0,5727.53,Winter,False,1.2881,dissapointed customer the phone is completely locked to verizon and not to at&t and t-mobile as you advertised and is no use to me unless i can somehow afford to unlock it. every sin card i insert is not recognized and all i get is this is not a verizon sim card. neither was there any headphones with the purchase.,False
ORD485135,ID5257193649,2019-06-07,Bakers,"[('iStream', 2), ('Alcon 10', 1)]",9250,48.71,-37.8120571,144.98821830000003,0,9298.71,Winter,False,0.6581,"not pleased with this purchase not pleased with this purchase, a fault discovered in my early use is, diminished and eventual inability to be heard during calls.",False
ORD397020,ID2774328319,2019-07-17,Bakers,"[('iStream', 2), ('Thunder line', 1), ('Toshika 750', 1), ('iAssist Line', 2)]",11250,48.34,-37.8048211,144.993781,5,10735.84,Winter,False,0.59,"defective after 3 months the phone seemed fine for about 3 months then the screen started having dead areas so i could not enter my pin or phone numbers etc. sometimes the screen is completely dead. now it has no warranty.olivia universe s4 sgh-i337 usa gsm unlocked cellphone, 16gb, frost white",False
ORD202134,ID3218226989,2019-07-31,Thompson,"[('Universe Note', 1), ('Thunder line', 2)]",7810,47.28,-37.8074349,144.9447892,15,6685.78,Winter,False,0.6166,phone doesn't work after only two weeks phone only lasted 2 weeks before blacking out and not turning back on.,False
ORD404059,ID4283908182,2019-08-13,Bakers,"[('Thunder line', 1), ('Candle Inferno', 2), ('iStream', 2), ('Alcon 10', 2)]",21240,54.98,-37.811421700000004,145.0098267,0,21294.98,Winter,False,1.2933,one star it has already locked down and can not be fixed by verizon. had to buy new phone yesterday,False
ORD395156,ID1463620519,2019-06-10,Bakers,"[('pearTV', 2), ('Thunder line', 1), ('Candle Inferno', 1), ('Lucent 330S', 1)]",16460,51.71,-37.8168733,145.00726609999995,5,15688.71,Winter,False,1.3062,you cannot switch a verizon contract to this phone the reviews and faqs are totally misleading it is a pre paid phone and cannot work with a existing contract until it has been used for 6 months as pre paid,False
ORD261796,ID4735836408,2019-07-29,Thompson,"[('Thunder line', 2), ('Toshika 750', 2)]",13000,52.48,-37.8032915,144.94979469999996,15,11102.48,Winter,False,1.0715,false ad — phone is locked i read reviews before purchase and saw all the complaints about locked and/or stolen phones. decided to take a chance anyways and got burned. don't buy from this shiesty seller.,False
ORD368575,ID1132069641,2019-06-11,Thompson,"[('Thunder line', 1), ('pearTV', 1)]",8490,44.58,-37.81407760000001,144.9446245,0,8534.58,Winter,False,0.2658,"the ""edge"" of the phone is pretty annoying. i constantly click things on accident with ... the ""edge"" of the phone is pretty annoying. i constantly click things on accident with my palm while reaching across the screen.",False
ORD372270,ID0266737766,2019-06-11,Nickolson,"[('Universe Note', 2), ('Olivia x460', 2), ('Alcon 10', 2)]",27250,50.8,-37.82203670000001,144.9797915,0,27300.8,Winter,False,0.9786,very disappointed. returned it immediately got a damaged product. the bixby button was broken. very disappointed. returned it immediately.,False
ORD180840,ID6167254907,2019-06-10,Nickolson,"[('iStream', 1), ('Universe Note', 1), ('Thunder line', 1)]",5780,47.24,-37.817686,144.9662605,25,4382.24,Winter,False,0.3065,does not work on current t-mobile doesn't work on t-mobile in nyc metro area as of 10/2018,False
ORD127833,ID4312130691,2019-08-22,Bakers,"[('Lucent 330S', 2), ('Universe Note', 2)]",9360,52.18,-37.8199018,144.99069319999995,0,9412.18,Winter,False,1.1727,"the worst experience just 20 days of use , the screen goes off ! to a complete horror ... bye..bye.. the screen is purple. it looks like it was dropped in water and kicked around. the phone is horrible. it didnt last even a month, be aware!",False
ORD246952,ID2187983890,2019-06-20,Nickolson,"[('Candle Inferno', 1), ('iAssist Line', 2), ('Universe Note', 2)]",11780,48.83,-37.8120976,144.9706706,15,10061.83,Winter,False,0.7299,well that sucks arrived shattered.,False
ORD436780,ID3208518271,2019-07-07,Nickolson,"[('iStream', 2), ('Universe Note', 1), ('Toshika 750', 2)]",12390,57.51,-37.8004531,144.97149330000005,25,9350.01,Winter,False,2.0267,worth it for the price low battery life,False
ORD448519,ID3240572177,2019-06-23,Thompson,"[('Candle Inferno', 2), ('pearTV', 1), ('Lucent 330S', 1), ('Alcon 10', 1)]",17350,54.35,-37.8055534,144.9296537,0,17404.35,Winter,False,1.7245,bad experience it froze on me the first week,False
ORD268406,ID6167265876,2019-06-19,Nickolson,"[('iStream', 1), ('iAssist Line', 1), ('Candle Inferno', 2), ('Lucent 330S', 2)]",5695,48.6,-37.8144502,144.96621530000004,0,5743.6,Winter,False,0.5467,not compatible with verizon not compatible with verizon,False
ORD064136,ID0267350498,2019-07-17,Nickolson,"[('Lucent 330S', 2), ('iStream', 1)]",2610,49.94,-37.8230924,144.97493390000002,25,2007.44,Winter,False,0.6890000000000001,good hardware bad os good hardware bad os,False
ORD494720,ID3161948955,2019-08-16,Thompson,"[('iStream', 2), ('pearTV', 1), ('Toshika 750', 1), ('Alcon 10', 2)]",28830,51.37,-37.8080675,144.9578502,10,25998.37,Winter,False,1.0779,dead after 42 days....ripoff. product is a failure. digico doesnt stand behind,False
ORD420976,ID5402876533,2019-04-08,Nickolson,"[('pearTV', 2), ('iAssist Line', 2), ('Candle Inferno', 2), ('Thunder line', 2)]",22290,77.65,-37.8212809,144.9769235,5,21253.15,Autumn,True,0.7139,"toshika = clean android excellent device, fingerprint scanner could be a bit higher but overall, excellent!",True
ORD020641,ID4787373723,2019-03-11,Nickolson,"[('iAssist Line', 1), ('pearTV', 2)]",14845,77.95,-37.8152518,144.9663639,25,11211.7,Autumn,True,0.4659,awesome upgrade everything works perfectly absolutely loved this phone this is my first google and i love the switch,True
ORD117608,ID0702478358,2019-03-26,Thompson,"[('Toshika 750', 2), ('Candle Inferno', 1), ('Lucent 330S', 2), ('Olivia x460', 1)]",12755,80.31,-37.80481560000001,144.94684019999997,25,9646.56,Autumn,True,0.8749,wonderful phone. excellent phone. it looks brand new. the battery is excellent. everything i tried works. aaa+++,True
ORD126470,ID3132495216,2019-03-15,Nickolson,"[('iAssist Line', 1), ('Lucent 330S', 1), ('Candle Inferno', 1)]",3885,77.34,-37.8148411,144.96479240000005,5,3768.09,Autumn,True,0.5914,very fast very good good product,True
ORD013037,ID6197211187,2019-05-28,Thompson,"[('iStream', 1), ('Thunder line', 2)]",4510,83.65,-37.814957899999996,144.9275311,5,4368.15,Autumn,True,1.7369,five stars nice,True
ORD019190,ID3419354761,2019-05-14,Nickolson,"[('Candle Inferno', 2), ('iStream', 1), ('pearTV', 1), ('Universe Note', 2)]",14220,79.35,-37.8092574,144.9721461,10,12877.35,Autumn,True,1.0642,good i like it good i like it,True
ORD481304,ID0287629297,2019-04-11,Thompson,"[('Universe Note', 1), ('Alcon 10', 2)]",21350,80.84,-37.804832299999994,144.9502409,5,20363.34,Autumn,True,0.9163,"good product i love this phone. huge upgrade from my honor 7x. battery life is good, sound is up to par with what i want, the screen and face reader work very well. overall, very happy with my purchase",True
ORD114451,ID0448078442,2019-03-30,Bakers,"[('iStream', 2), ('Thunder line', 1), ('pearTV', 1), ('Candle Inferno', 1)]",9220,81.57,-37.799876,144.984555,10,8379.57,Autumn,True,1.4666,five stars it was a decent item. i can't complain.,True
ORD196113,ID0844489299,2019-05-21,Thompson,"[('Lucent 330S', 2), ('Thunder line', 2), ('Candle Inferno', 2)]",7680,81.73,-37.8208693,144.9480861,25,5841.73,Autumn,True,0.9167,tablet is great does everythimg as it should. great entry level tablet,True
ORD101108,ID0577456440,2019-05-20,Bakers,"[('Candle Inferno', 1), ('Alcon 10', 1)]",9380,81.52,-37.8231459,144.9885529,10,8523.52,Autumn,True,1.5772,convoy 2 yes i like my convoy. a few more surface blemishes than i had hoped for but very functional. i think it will serve me well.,True
ORD318370,ID1668523489,2019-05-24,Thompson,"[('Toshika 750', 1), ('Olivia x460', 2)]",6770,81.58,-37.8239328,144.9494145,25,5159.08,Autumn,True,1.2702,thanks thanks,True
ORD462440,ID0247020726,2019-04-28,Nickolson,"[('Lucent 330S', 1), ('Candle Inferno', 2), ('Thunder line', 2), ('iAssist Line', 2)]",10900,79.46,-37.8129108,144.96909330000003,15,9344.46,Autumn,True,0.634,seems like a great buy i bought this for my daughter and she seems very pleased with it. we use ting as our phone service and it was super simple to set up.,True
ORD117465,ID2288769459,2019-05-21,Bakers,"[('Lucent 330S', 1), ('Olivia x460', 1), ('Universe Note', 1), ('Toshika 750', 1)]",10225,80.19,-37.801406899999996,145.003197,0,10305.19,Autumn,True,1.1853,"as advertised! great phone, like new condition (no blemishes). took it to verizon store, and they put in a sim card and had the phone operational in just a few mins (no charge). trusted vendor with a great product.",True
ORD270470,ID0634783920,2019-03-21,Thompson,"[('Toshika 750', 1), ('pearTV', 2), ('iStream', 1)]",17090,80.23,-37.8130415,144.93731110000004,0,17170.23,Autumn,True,0.8591,"great phone! still working like a charm for me! good seller, good product!",True
ORD125618,ID0777753004,2019-03-19,Thompson,"[('Candle Inferno', 2), ('Thunder line', 2), ('Universe Note', 2)]",12120,80.94,-37.805912899999996,144.95575680000005,10,10988.94,Autumn,True,1.0724,quality and battery life this device works and looks like a new phone.,True
ORD422993,ID4740821319,2019-03-11,Thompson,"[('iStream', 2), ('Olivia x460', 1)]",1525,79.78,-37.8033989,144.9497761,0,1604.78,Autumn,True,1.0595,money well spent like new device. came as a t-mobile phone but wats easily moved to at$t. highly recommend for the money.,True
ORD443113,ID0577457233,2019-04-08,Nickolson,"[('iStream', 1), ('Toshika 750', 1)]",4470,79.41,-37.81996270000001,144.98020449999999,10,4102.41,Autumn,True,0.9491,very pleased the phone was as expected and i am very pleased thank you,True
ORD410194,ID0723967382,2019-05-16,Bakers,"[('Lucent 330S', 2), ('iStream', 1), ('Candle Inferno', 2), ('Thunder line', 2)]",7830,81.98,-37.804207299999995,145.0026874,5,7520.48,Autumn,True,0.9193,great buy! perfect,True
ORD290968,ID0664379337,2019-03-26,Nickolson,"[('Universe Note', 1), ('Olivia x460', 2)]",5900,78.29,-37.8203302,144.96563909999998,15,5093.29,Autumn,True,0.3945,this is my 2nd inferno tablet. i will alwyas need one. just wish they lasted longer than 4 years.,True
ORD178390,ID0356474514,2019-04-26,Bakers,"[('Alcon 10', 1), ('iStream', 2), ('Universe Note', 2), ('Olivia x460', 1)]",17375,80.71,-37.7996059,144.9906674,15,14849.46,Autumn,True,1.2243,great phone at a nice price. this was purchased by a friend who was visiting from belgium. he was replacing a old version as a gift for his mom and the pricing in the us was half of what he would have paid in europe. he was extremely pleased.,True
ORD183656,ID1224832128,2019-05-21,Thompson,"[('Toshika 750', 2), ('Alcon 10', 1)]",17590,79.17,-37.8141146,144.93882390000005,0,17669.17,Autumn,True,0.7426,"g7 - a really great phone for the price! i think it's a great value. it works very well & has a great battery life & speed. i am very happy with it. the camera is good, but doesn't match up to an pear phone though. thumbs up!",True
ORD486719,ID0746921974,2019-04-21,Nickolson,"[('Olivia x460', 2), ('Toshika 750', 2), ('iStream', 2), ('Universe Note', 1)]",14840,83.24,-37.825681599999996,144.98477490000005,5,14181.24,Autumn,True,1.5538,for the money the candle inferno is the best tablet on the market. i wish i didn't buy my i pad already i would have got one of these for myself.,True
ORD121059,ID2177124624,2019-03-03,Thompson,"[('Toshika 750', 2), ('Alcon 10', 1), ('pearTV', 1), ('Candle Inferno', 2)]",24760,80.25,-37.816412400000004,144.95580280000001,10,22364.25,Autumn,True,0.8736,the best phone i have ever used the best phone i have ever used... great battery life... beautiful screen just love my s8 plus.... only thing is have to keep it fragile as the body is all beautiful glass.. rest everything is deluce,True
ORD198687,ID6024429122,2019-05-23,Thompson,"[('Candle Inferno', 2), ('Thunder line', 2)]",5220,77.61,-37.8154612,144.94052240000005,10,4775.61,Autumn,True,0.654,"love the phone love the phone. only problem, look out for model number. 900 is 3g only. 900.1 was phone i replaced due to breakage is 4g/lte, so i lost the faster data rate with this phone. still works great though...",True
ORD406018,ID0777782541,2019-05-27,Thompson,"[('Olivia x460', 2), ('Lucent 330S', 2), ('pearTV', 1)]",11220,80.52,-37.8045815,144.9537947,0,11300.52,Autumn,True,1.0776,"it's a great phone that's super quick it's a great phone that's super quick, freeware picture and screen quality, and overall a great purchase. my only gripe is that it came very scratched up and blemishes underneath the gorilla glass screen.",True
ORD116601,ID1725216871,2019-04-05,Nickolson,"[('Universe Note', 2), ('Alcon 10', 2), ('Lucent 330S', 1), ('Toshika 750', 1)]",30350,81.03,-37.8067646,144.9644611,10,27396.03,Autumn,True,1.3909,"three stars great phone when it works, but multiple pixel phones ive had have issues with random reboots.",True
ORD074119,ID2266560308,2019-04-17,Thompson,"[('Olivia x460', 1), ('pearTV', 2), ('Lucent 330S', 1), ('iAssist Line', 2)]",19525,78.36,-37.8117066,144.95629169999995,5,18627.11,Autumn,True,0.8182,buen producto excellent,True
ORD415190,ID4884445055,2019-03-28,Thompson,"[('pearTV', 2), ('Alcon 10', 1), ('Toshika 750', 2)]",30210,83.38,-37.800267100000006,144.93402360000005,5,28782.88,Autumn,True,1.7954,best purchase i've made love it,True
ORD137058,ID1253853406,2019-03-15,Nickolson,"[('Lucent 330S', 2), ('Candle Inferno', 2), ('Alcon 10', 1), ('iStream', 2)]",12570,81.92,-37.8081488,144.975634,10,11394.92,Autumn,True,1.28,amazing user experience with of the cost of the top brands it has all the functionality and user experience as a top brad but with half of the price!,True
ORD055775,ID2936341076,2019-04-16,Nickolson,"[('Candle Inferno', 1), ('Universe Note', 2)]",7330,79.51,-37.818459499999996,144.9677262,25,5577.01,Autumn,True,0.1612,five stars best phone i have brought to date!,True
ORD024530,ID0310729981,2019-04-10,Thompson,"[('Olivia x460', 2), ('pearTV', 1)]",8760,77.23,-37.8131411,144.9391035,25,6647.23,Autumn,True,0.7024,good price i like all of it.,True
ORD296147,ID2643051710,2019-03-28,Bakers,"[('iAssist Line', 2), ('Toshika 750', 2), ('pearTV', 2)]",25710,81.73,-37.8148117,145.01330159999995,5,24506.23,Autumn,True,1.6771,thanks i really enjoy my new olivia universe s4 blackcell phone. its different from all the other cell phones i ever had,True
ORD312768,ID3144992690,2019-03-01,Bakers,"[('pearTV', 2), ('Lucent 330S', 2), ('Olivia x460', 2), ('Toshika 750', 2)]",26170,80.88,-37.8144218,144.9851069,10,23633.88,Autumn,True,1.0176,"the battery health i checked 'settings/battery/battery health(beta)', which said "" your battery's health is significantly degraded."" i bought a ""refurbished"" alcon, and expected its battery was good, but it wasn't.",True
ORD422811,ID1982447711,2019-03-03,Bakers,"[('Olivia x460', 2), ('Lucent 330S', 1), ('iStream', 1)]",3830,80.14,-37.816011100000004,145.0057554,10,3527.14,Autumn,True,1.1423,the xp quality you remember. xp is back to being in competition! very well built and fast. other reviews said was slow but with the pie update it is blazing fast. camera is excellent.,True
