order_id,customer_id,date,nearest_warehouse,shopping_cart,order_price,delivery_charges,customer_lat,customer_long,coupon_discount,order_total,season,is_expedited_delivery,distance_to_nearest_warehouse,latest_customer_review,is_happy_customer
ORD202350,ID0664379342,2019-12-09,Nickolson,"[('Olivia x460', 1), ('Lucent 330S', 2), ('pearTV', 1), ('Toshika 750', 2)]",18635,69.01,-37.820479999999996,144.9657125,0,18704.01,Summer,False,0.3974,"great phone considering the price its really cheaply made, every time i drop it the battery cover falls off and the battery goes flying, but for $15 it really is a great phone.",True
ORD236387,ID3327893029,2019-01-22,Thompson,"[('Toshika 750', 2), ('Olivia x460', 2)]",11090,78.12,-37.8065465,144.9595075,5,10613.62,Summer,False,1.2891,great phone great phone. half the price of the s10 but great performance.,True
ORD387431,ID0309346901,2019-02-08,Bakers,"[('Alcon 10', 1), ('Universe Note', 1), ('pearTV', 1), ('iAssist Line', 1)]",20935,79.88,-37.813628200000004,145.0047619,0,21014.88,Summer,True,0.9305,use phone an i paid for a new phone the phone is a use phone when i did the ordering it was for a new phone i am very disappointed . so what u saying for this was it a miss take .it will only stay change for less them an hour .,False
ORD302527,ID4520380448,2019-12-28,Nickolson,"[('Lucent 330S', 1), ('Olivia x460', 1)]",2455,78.27,-37.822584,144.9610415,25,1919.52,Summer,True,0.8701,lenovo fw support unsat wifi calling doesn't work right after fw update to 8.1 oreo. lenovo's fw update is a joke. it's been months and no fix. they broke the phone with their update to 8.1. stay away from lenovo products.,False
ORD420652,ID1899262795,2019-02-19,Thompson,"[('Olivia x460', 1), ('pearTV', 1), ('Toshika 750', 2), ('iStream', 1)]",16325,87.61,-37.8032916,144.96302419999995,25,12331.36,Summer,True,1.7492,dislike i dislike the fact that the id i'm supposed to use with the phone isn't even available where i registered the phone.,False
ORD103999,ID0312718907,2019-01-25,Thompson,"[('iStream', 2), ('Lucent 330S', 1)]",1530,87.19,-37.8018402,144.9608092,0,1617.19,Summer,True,1.7072,unfair marketing it was not what they written on description,False
ORD063265,ID4418536056,2019-01-21,Thompson,"[('Lucent 330S', 1), ('Olivia x460', 1), ('pearTV', 1), ('iAssist Line', 1)]",10990,88.52,-37.8025047,144.9629879,5,10529.02,Summer,True,1.8004,looking for a phone that will actually work. this phone is horrible. it doesn't ring. sends calls to voicemail. the settings are correct and it still doesn't work! i hate it.,False
ORD494568,ID6167489373,2019-12-10,Thompson,"[('Alcon 10', 1), ('Thunder line', 1), ('Toshika 750', 2), ('iStream', 1)]",19920,78.45,-37.8122482,144.9575937,5,19002.45,Summer,True,0.9268,"do not buy it’s only been a few days and the alcon won’t charge, really disappointing i want a new one",False
ORD208119,ID1728560667,2019-01-07,Thompson,"[('Olivia x460', 2), ('Candle Inferno', 1)]",2880,84.44,-37.8214965,144.93573490000003,5,2820.44,Summer,True,1.3993,phone and decisions i would only buy again last resort,False
ORD002612,ID0575386408,2019-01-08,Nickolson,"[('Toshika 750', 1), ('iStream', 1), ('Thunder line', 2)]",8830,82.93,-37.82000220000001,144.9844458,0,8912.93,Summer,True,1.3191,not unlocked returned phone it was not unlocked and i could not activate. arrived on time but could not use the phone.,False
ORD106760,ID0844482981,2019-02-03,Thompson,"[('pearTV', 1), ('Alcon 10', 2)]",24210,79.06,-37.8206946,144.9487901,15,20657.56,Summer,True,0.9057,nunca llego esperaba el teléfono para hacer un regalo de cumpleaños y no llego,False
ORD474851,ID6167344584,2019-12-30,Nickolson,"[('Toshika 750', 1), ('Alcon 10', 2), ('iAssist Line', 1)]",24445,73.26,-37.81497879999999,144.97207580000003,15,20851.51,Summer,True,0.4597,one star it started off ok but now the phone won't charge after not even a month i'm dissatisfied and annoyed,False
ORD467055,ID3218293528,2019-01-12,Thompson,"[('Candle Inferno', 1), ('Olivia x460', 1), ('iAssist Line', 2)]",6105,81.42,-37.803192700000004,144.9472978,15,5270.67,Summer,True,1.0555,the only thing we don't like is that it had to stay plugged in to work.,False
ORD366469,ID0846567658,2019-01-28,Nickolson,"[('Universe Note', 1), ('Lucent 330S', 2)]",5910,74.5,-37.8233768,144.969933,15,5098.0,Summer,True,0.5334,i've bought 3 only the first one works messaging doesn't send or receive pictures. won't connect through usb to download pictures. won't let me set up a voicemail.,False
ORD257247,ID1479905329,2019-12-05,Nickolson,"[('Olivia x460', 1), ('Thunder line', 2)]",5585,82.0,-37.821130200000006,144.9577365,15,4829.25,Summer,True,1.0765,"bad quality the product was very bad quality. the headphones and charger ports we're scratched, also scratches on the back. no original charger or box. save your money and skip this product.",False
ORD128200,ID0247418909,2019-01-08,Nickolson,"[('Toshika 750', 2), ('Lucent 330S', 2), ('iAssist Line', 2)]",15550,71.33,-37.8183744,144.9685475,10,14066.33,Summer,True,0.0916,one star the order did not arrive,False
ORD188878,ID0571731201,2019-01-09,Thompson,"[('iAssist Line', 1), ('iStream', 1)]",2375,82.0,-37.8244894,144.94609690000001,15,2100.75,Summer,True,1.3181,already freezing after one month this phone has to be the absolutely worst phone i've ever purchased from toshika. i suspect it was used and unfortunately it started freezing after the return date was reached. i am going to see what i can do about exchanging this for a different phone. extremely disappointed!!,False
ORD187666,ID5619579757,2019-12-08,Bakers,"[('Alcon 10', 1), ('iStream', 1), ('Olivia x460', 2)]",11550,88.8,-37.8172426,145.0140944,15,9906.3,Summer,True,1.8445,don't work good where i stayed in rural area don't pickup good the phone quality is nice,False
ORD256486,ID0571459351,2019-12-15,Thompson,"[('Candle Inferno', 2), ('Lucent 330S', 2), ('pearTV', 1), ('iAssist Line', 2)]",14080,76.49,-37.810778000000006,144.9391446,0,14156.49,Summer,True,0.7281,not worth buying phone doesn't stay connected to at&t signal,False
ORD332415,ID5457978562,2019-01-31,Thompson,"[('iAssist Line', 2), ('Toshika 750', 1), ('iStream', 2), ('Candle Inferno', 1)]",9500,79.4,-37.819719299999996,144.941013,0,9579.4,Summer,True,0.9481,"defective pos dead after 5 months don't buy a defective ""refurbished"" product from this seller. the phone died within 5 months of purchase, and pear says that it is not possible to repair, since the issue is with damage to the charging port during the refurbishing.",False
ORD078987,ID2421601627,2019-02-03,Thompson,"[('iStream', 2), ('Thunder line', 1), ('Olivia x460', 2), ('iAssist Line', 2)]",9380,66.86,-37.8263639,144.9518351,10,8508.86,Summer,False,1.5806,cell wouldn't know anything about the cell phone i ordered because the person hasn't even shipped it yet. it's been a month! and digico has does nothing to help and really has nothing for an option to provide assistance.,False
ORD115383,ID0628177517,2019-01-30,Thompson,"[('Olivia x460', 2), ('Universe Note', 2), ('pearTV', 2)]",21970,49.8,-37.8120017,144.9478347,5,20921.3,Summer,False,0.1006,"defective. completely worthless. it doesn't work. it came with a single sim tray, so when i put in my sim it gave the error ""sim 2 not allowed"". so i purchased another dual sim tray and tried it in sim slot 1... same error. purchased a new sim card from my carrier, same error. the product doesn't work.",False
ORD025463,ID5797734219,2019-01-18,Thompson,"[('Olivia x460', 2), ('Lucent 330S', 1), ('Universe Note', 1), ('Alcon 10', 2)]",25030,60.45,-37.8036352,144.9486406,0,25090.45,Summer,False,1.0155,seemed like a used phone wasn't happy as the phone looked used. the case was opened and didn't look great. wanted to return but changed locations.,False
ORD433102,ID0176721271,2019-01-24,Nickolson,"[('Alcon 10', 1), ('Lucent 330S', 1)]",10180,53.87,-37.8141917,144.9671072,25,7688.87,Summer,False,0.5352,one star loved it while it lasted. died after 6 mos and no verizon warranty.,False
ORD220389,ID2239389711,2019-12-05,Bakers,"[('Candle Inferno', 2), ('Olivia x460', 2)]",3310,54.97,-37.8136381,145.000099,25,2537.47,Summer,False,0.5895,not unlocked i just returned from verizon wireless store. after transferring all my data i went to get a new sim card. they said this phone is an international phone not usable with verizon. wasted lots of time and now i have the pain of needing the ship back.,False
ORD488088,ID0176721271,2019-12-01,Nickolson,"[('iStream', 2), ('iAssist Line', 2), ('Candle Inferno', 1)]",5180,52.85,-37.8141917,144.9671072,25,3937.85,Summer,False,0.5352,one star this phone doesnt work! some day just die and thats it!,False
ORD445016,ID0746912573,2019-12-14,Nickolson,"[('Lucent 330S', 1), ('Thunder line', 1), ('Toshika 750', 2), ('Alcon 10', 2)]",29950,63.11,-37.8242403,144.98317350000005,15,25520.61,Summer,False,1.3527,didn't work did not work,False
ORD069064,ID0163364730,2019-02-18,Thompson,"[('Universe Note', 1), ('Candle Inferno', 2)]",4310,56.58,-37.8134219,144.9533437,0,4366.58,Summer,False,0.5581,"no recibí el producto el producto lo robaron durante el envío y tuve que hacer devolución, que mal momento",False
ORD009495,ID3161949463,2019-12-09,Thompson,"[('Thunder line', 1), ('Alcon 10', 2), ('iAssist Line', 2)]",24530,60.23,-37.808403999999996,144.95666210000005,0,24590.23,Summer,False,0.9683,phones are reported stolen and dont work per sprint stolen phones and accessories were shipped that can not be activated . these olivia phone can not be activated and are reported stolen from sprint. watch out they are also used and dirty phones.,False
ORD490870,ID0317535757,2019-02-09,Nickolson,"[('pearTV', 2), ('Universe Note', 1)]",16070,65.33,-37.8064746,144.9651665,25,12117.83,Summer,False,1.4032,not good not good,False
ORD345200,ID1449285254,2019-01-08,Nickolson,"[('Alcon 10', 2), ('iStream', 1)]",18050,62.71,-37.81611760000001,144.9826679,25,13600.21,Summer,False,1.186,supposed to be water resistant....not! accidentally got briefly immersed. now is a brick! ugh!,False
ORD112079,ID0294625652,2019-02-13,Nickolson,"[('Toshika 750', 2), ('Universe Note', 1)]",12090,56.67,-37.819649299999995,144.96165369999997,25,9124.17,Summer,False,0.7043,disappointed with voice quality and had to return i had to return the phone as the voice quality was not good. the calls kept getting cut and the conversations was distorted. most probably because it was refurbished.,False
ORD007178,ID5276517410,2019-12-22,Nickolson,"[('Candle Inferno', 1), ('Alcon 10', 2), ('Olivia x460', 1), ('Universe Note', 2)]",26455,56.98,-37.815264299999996,144.9777675,10,23866.48,Summer,False,0.8121,one star broke after one week,False
ORD038110,ID0245535118,2019-01-22,Nickolson,"[('Candle Inferno', 1), ('iStream', 1), ('Universe Note', 2), ('Alcon 10', 1)]",16430,56.47,-37.812584,144.967539,5,15664.97,Summer,False,0.6921,i am bring it back for an exchange. (a different make),False
ORD359681,ID0257503245,2019-02-15,Thompson,"[('Alcon 10', 2), ('iStream', 1)]",18050,70.89,-37.799799799999995,144.9616154,5,17218.39,Summer,False,1.921,very disappointed as it was a present for my teenage son did not work. it wouldn't charge and the microphone was not working. very disappointed as it was a present for my teenage son.,False
ORD415229,ID0655124623,2019-02-15,Thompson,"[('Universe Note', 1), ('iAssist Line', 1), ('Lucent 330S', 2)]",8135,56.9,-37.8076523,144.94262460000004,10,7378.4,Summer,False,0.682,i wouldn’t do it 🤷🏽‍♂️ package arrived on time. but the phone was not unlocked as advertised,False
ORD289798,ID0137182984,2019-07-06,Nickolson,"[('Universe Note', 2), ('Olivia x460', 2)]",9350,83.81,-37.803596899999995,144.96651169999996,5,8966.31,Winter,True,1.6908,worth every cent.,True
ORD182162,ID2189497204,2019-08-16,Nickolson,"[('pearTV', 1), ('Universe Note', 1), ('Candle Inferno', 1), ('Thunder line', 2)]",14550,77.36,-37.810842799999996,144.9729476,15,12444.86,Winter,True,0.9132,"excelente hasta el momento el celular ha funcionado perfecto! sin ninguna falla, estoy muy contenta y lo recomendaría 100% ya qué precio y calidad van de la mano",True
ORD030995,ID0702373605,2019-07-16,Thompson,"[('Olivia x460', 2), ('Candle Inferno', 2), ('Universe Note', 2)]",10210,77.05,-37.8074024,144.9423104,15,8755.55,Winter,True,0.7207,"a good purchase, excellent value phone looked new, could not see ware or scratches, was unlocked and ready to setup. came in a plane white box, and include all attachments. charger. charger cord, ear phone adapter, data transfer cable. usb dongle...they were not oem but all work and work well",True
ORD224004,ID4326586175,2019-08-15,Thompson,"[('iAssist Line', 1), ('Lucent 330S', 2), ('Candle Inferno', 2)]",5545,81.68,-37.8010546,144.956769,5,5349.43,Winter,True,1.5494,phone works well so far arrived on time and works well. fantastic pics and video!,True
ORD486660,ID1713460710,2019-08-26,Nickolson,"[('Thunder line', 1), ('Alcon 10', 1), ('Olivia x460', 2), ('Universe Note', 2)]",20480,77.94,-37.809416799999994,144.97222140000005,5,19533.94,Winter,True,1.0483,i've had multiple digico inferno tablets. they are a great bargain. i love the ease of use and functionality. the only downfall is that it is really slow to charge.,True
ORD416386,ID1519470918,2019-07-16,Bakers,"[('Lucent 330S', 1), ('Toshika 750', 2), ('pearTV', 1), ('Universe Note', 2)]",23080,79.15,-37.7976237,144.9932622,25,17389.15,Winter,True,1.3881,"they ship on time no scratches, works great, would recommend",True
ORD133767,ID0319157896,2019-08-28,Nickolson,"[('pearTV', 2), ('iAssist Line', 2), ('Olivia x460', 1), ('iStream', 1)]",18445,79.67,-37.8058061,144.9667357,25,13913.42,Winter,True,1.445,you like gaming on mobile? this is a great choice phone is effing awesome,True
ORD018075,ID1201417384,2019-07-08,Thompson,"[('iAssist Line', 1), ('Toshika 750', 1), ('iStream', 1)]",6695,86.06,-37.799487899999995,144.92750900000001,10,6111.56,Winter,True,2.2614,five stars nice phone!,True
ORD021835,ID0294623058,2019-08-15,Nickolson,"[('Universe Note', 2), ('iStream', 2), ('Toshika 750', 1)]",11520,75.92,-37.8190576,144.96424530000004,10,10443.92,Winter,True,0.4694,"great phone,excellent condition phone arrived early, was in great condition and work perfectly with my cricket sim card",True
ORD463808,ID0702373605,2019-06-03,Thompson,"[('Lucent 330S', 2), ('iStream', 1), ('iAssist Line', 2)]",7060,75.67,-37.8074024,144.9423104,0,7135.67,Winter,True,0.7207,that it is sold by vets hiring vets and donating profits to vets love the phone,True
ORD182857,ID0317903855,2019-06-22,Thompson,"[('Toshika 750', 1), ('iAssist Line', 2)]",8770,79.28,-37.8085408,144.95788340000001,15,7533.78,Winter,True,1.0565,"the casing needs to be imroved. i did not like the metallic casing otherwise, all other things are nice",True
ORD038992,ID0356099773,2019-06-22,Bakers,"[('Olivia x460', 1), ('Lucent 330S', 1), ('pearTV', 1), ('iStream', 2)]",9065,79.29,-37.8203369,144.9902518,15,7784.54,Winter,True,1.2316,bestest battery ever ! perfect n fastest shipping,True
ORD143746,ID2174950795,2019-08-05,Thompson,"[('Universe Note', 2), ('iStream', 1), ('pearTV', 1)]",13360,76.25,-37.8155909,144.95264,15,11432.25,Winter,True,0.5878,excellent,True
ORD261457,ID4544035094,2019-08-25,Nickolson,"[('Universe Note', 2), ('iStream', 2)]",7200,75.58,-37.8119326,144.96362209999995,0,7275.58,Winter,True,0.9066,"came as described purchased a pixel xl from buyspry and was incredibly reluctant to do so via third party, but everything came brand new, in the box as described and i'm happy. much appreciated.",True
ORD335940,ID0400812567,2019-08-07,Nickolson,"[('Lucent 330S', 2), ('Thunder line', 1), ('iAssist Line', 1), ('pearTV', 2)]",19485,81.25,-37.8236871,144.95599199999995,5,18592.0,Winter,True,1.3202,"that it works i love it for what i use it for, the battery last more then 2 days with light use",True
ORD402970,ID3213448181,2019-06-30,Thompson,"[('Toshika 750', 2), ('iAssist Line', 2)]",13090,80.89,-37.8044157,144.95929569999996,10,11861.89,Winter,True,1.4147,"very good phone this is one of the best phones that i have had. the battery life is the main attraction for me. on a full charge, it will go all day. the screen is also very clear.",True
ORD038440,ID0363400139,2019-06-07,Thompson,"[('iAssist Line', 1), ('Thunder line', 2)]",6585,84.28,-37.799501,144.9624976,5,6340.03,Winter,True,1.9978,great this is my first android phone,True
ORD134387,ID6167441027,2019-06-24,Thompson,"[('Candle Inferno', 2), ('iAssist Line', 1)]",3085,79.21,-37.8091936,144.9610091,0,3164.21,Winter,True,1.2857,good bang for buck good value,True
ORD138955,ID1458422285,2019-08-24,Bakers,"[('iStream', 2), ('Thunder line', 2)]",4660,78.16,-37.816669,145.008826,15,4039.16,Winter,True,1.4075,good display good battery but slow cool phone if you care mainly about battery and colourful huge display then it's perfect only downsides for me is no water resitants and the processor is very slow can't play the newest games very well,True
ORD318190,ID6202471409,2019-08-16,Nickolson,"[('pearTV', 1), ('Olivia x460', 1), ('iAssist Line', 2), ('Lucent 330S', 2)]",14445,79.62,-37.8215657,144.9805243,0,14524.62,Winter,True,1.02,thank you!! i have been waiting for this phone for so long. my note5 needed an upgrade and all i can say is this phone is freaking awesome. it was very affordable and i received it right on time brand new and unlocked.,True
ORD272712,ID0361771293,2019-08-21,Bakers,"[('Olivia x460', 1), ('Universe Note', 2), ('Alcon 10', 1), ('iAssist Line', 2)]",21525,83.26,-37.800384,144.9799401,15,18379.51,Winter,True,1.7187,works great i was kinda scared but digico's return police convinced me. 100% satisfied. the phone looked and acted new in every way.,True
ORD038002,ID0443264066,2019-07-28,Bakers,"[('Thunder line', 1), ('iAssist Line', 2)]",6630,80.87,-37.8231522,145.0015584,5,6379.37,Winter,True,1.5666,good phone no question i brought this phone for my lil sister in canada she likes it. she said it is a awesome phone.,True
ORD106196,ID2776394279,2019-08-06,Nickolson,"[('iStream', 1), ('Universe Note', 1), ('Candle Inferno', 1), ('Alcon 10', 1)]",12980,77.54,-37.812028999999995,144.9635865,25,9812.54,Winter,True,0.8996,five stars one of the best phones i have ever had .. and fast shipping :),True
ORD111299,ID5797722962,2019-06-27,Thompson,"[('pearTV', 1), ('Lucent 330S', 1)]",7540,74.65,-37.806413,144.944002,0,7614.65,Winter,True,0.7472,works good works good,True
ORD320106,ID0844455717,2019-06-16,Thompson,"[('pearTV', 1), ('Thunder line', 2), ('Alcon 10', 1), ('Olivia x460', 2)]",22070,76.27,-37.82089860000001,144.9475678,10,19939.27,Winter,True,0.9167,"solid hardware and great features. got this for my mother as a christmas gift. as someone who never had a smartphone before she loves it. does everything you would want a smartphone to do, and easy enough to learn. although a few models behind, the hardware is solid. love the camera quality as well.",True
ORD088191,ID0319617926,2019-08-03,Bakers,"[('Toshika 750', 1), ('Universe Note', 1), ('Thunder line', 1)]",9950,76.47,-37.811124299999996,145.0017881,25,7538.97,Winter,True,0.5901,good phone. awesome shopping experience its a big improvement over s9+,True
ORD158408,ID1889073821,2019-07-09,Bakers,"[('Toshika 750', 2), ('iAssist Line', 1), ('iStream', 2), ('Olivia x460', 2)]",13615,78.99,-37.80892,144.98255,25,10290.24,Winter,True,1.1218,five stars excellent product!!,True
ORD020177,ID4367140159,2019-06-06,Thompson,"[('Universe Note', 1), ('Candle Inferno', 2), ('Alcon 10', 2), ('iStream', 2)]",22510,85.09,-37.7993958,144.9619289,0,22595.09,Winter,True,1.973,"five stars terrific phone. everything works, works crisply and works well. elegant too.",True
ORD231748,ID1597543242,2019-06-30,Nickolson,"[('iAssist Line', 1), ('Alcon 10', 1), ('Lucent 330S', 2), ('iStream', 2)]",13935,76.59,-37.8202117,144.9777365,25,10527.84,Winter,True,0.7419,edge to edge display love the large clear bright display. easy to use and setup.,True
ORD398225,ID0560987190,2019-06-01,Thompson,"[('Olivia x460', 2), ('Candle Inferno', 1)]",2880,77.69,-37.82141970000001,144.9454782,5,2813.69,Winter,True,0.9836,straight talk will this phone work for straight talk ?,True
ORD439008,ID0448103596,2019-06-05,Thompson,"[('Lucent 330S', 1), ('iAssist Line', 2), ('Thunder line', 1)]",7860,78.1,-37.8153669,144.93540149999995,0,7938.1,Winter,True,1.069,this is my first e-reader. i didn't know about the odd refresh and it took a little while to get used to but i do love how small and light it is and that i do not have to remember to plug it in everyday,True
ORD152795,ID0589306639,2019-07-20,Nickolson,"[('Olivia x460', 1), ('Toshika 750', 1), ('iAssist Line', 2)]",9995,78.38,-37.8106018,144.9718113,10,9073.88,Winter,True,0.9117,phone functions well so far. seems if the battery ... phone functions well so far. seems if the battery may not be as strong as my other phone but we shall see.,True
ORD097044,ID1458422322,2019-07-28,Bakers,"[('iAssist Line', 2), ('Thunder line', 1), ('Alcon 10', 1)]",15580,79.96,-37.8186401,145.00569480000001,0,15659.96,Winter,True,1.3313,"great for e-reading on the go, nice and light weight, and for the price point given, definitely worth the purchase.",True
ORD425642,ID2632208067,2019-06-26,Bakers,"[('iStream', 1), ('Thunder line', 1), ('Candle Inferno', 2), ('Toshika 750', 2)]",11830,76.69,-37.8178994,144.989793,10,10723.69,Winter,True,1.0014,good dealing with you ! good dealing with you !,True
ORD112191,ID0777793471,2019-08-03,Thompson,"[('Toshika 750', 2), ('Candle Inferno', 2), ('iAssist Line', 1), ('Lucent 330S', 2)]",14185,76.6,-37.8062531,144.9557032,0,14261.6,Winter,True,1.0428,great product like new product. hardly any scratches on the screen and no where else,True
ORD180298,ID0576868759,2019-06-26,Bakers,"[('iStream', 1), ('Toshika 750', 1), ('iAssist Line', 2)]",8920,81.12,-37.824038,144.99054130000005,5,8555.12,Winter,True,1.6166,good phone i love this phone and the camera but i wish it was scratch proof like the other toshika phones,True
ORD110923,ID2174950794,2019-06-07,Thompson,"[('Alcon 10', 2), ('Lucent 330S', 1), ('pearTV', 1), ('iStream', 1)]",25590,76.81,-37.8189732,144.9542227,0,25666.81,Winter,True,0.9421,corrected review my earlier feedback was not correct because i did not understand the difference between gb storage and gb ram. this is a wonderful phone and good price. i would buy again.,True
ORD132944,ID0710015889,2019-06-17,Thompson,"[('iAssist Line', 1), ('Toshika 750', 2), ('iStream', 1)]",11015,77.74,-37.815608399999995,144.9357637,10,9991.24,Winter,True,1.0465,very good i'm very great full with this product,True
ORD314010,ID0529205331,2019-06-14,Thompson,"[('Lucent 330S', 1), ('iAssist Line', 2), ('pearTV', 1), ('Toshika 750', 2)]",20630,79.17,-37.8232994,144.9380257,15,17614.67,Winter,True,1.4253,"five stars great buy, great phone",True
ORD131767,ID1715989157,2019-07-25,Nickolson,"[('Thunder line', 1), ('Lucent 330S', 2), ('Universe Note', 1), ('Candle Inferno', 1)]",8520,73.8,-37.8187336,144.967859,5,8167.8,Winter,True,0.1496,easy to use phone was purchased for an older technology challenged person. they needed an easy to use phone without a ton of bloatware. this phone being an entry level phone but quality made is perfect. if it were not that the phone came in a generic box i would have guessed it was renewed.,True
ORD180402,ID2960412637,2019-06-27,Nickolson,"[('Alcon 10', 1), ('iAssist Line', 2)]",13400,72.91,-37.818191299999995,144.9669356,5,12802.91,Winter,True,0.2343,good good product,True
ORD418275,ID3121574837,2019-06-18,Bakers,"[('Toshika 750', 1), ('Universe Note', 2), ('Candle Inferno', 2)]",12080,62.17,-37.8040971,144.99548969999995,10,10934.17,Winter,False,0.6571,get it work really good great price,True
ORD226205,ID0579500430,2019-06-17,Thompson,"[('Candle Inferno', 1), ('Toshika 750', 1), ('Alcon 10', 1)]",13700,61.8,-37.814721,144.9500803,15,11706.8,Winter,False,0.3494,"nice phone...better read spanish tho i really like the phone. only problems are when system updates come, they are in spanish. they don't translate to english. also, i am not totally sure my phone is registered for the warranty. i've tried several times bit the lucentrola keeps looping to beginning.",True
ORD204104,ID0591434144,2019-07-25,Nickolson,"[('iAssist Line', 1), ('Alcon 10', 2), ('Candle Inferno', 1)]",20555,62.05,-37.818661299999995,144.9678091,15,17533.8,Winter,False,0.1534,that's great! that's great!,True
ORD268267,ID3215191997,2019-06-25,Thompson,"[('pearTV', 1), ('iAssist Line', 1), ('Thunder line', 1), ('iStream', 2)]",11015,63.85,-37.805798700000004,144.948245,25,8325.1,Winter,False,0.7722,value phone.at a great price and quick shipping. great replacement phone for those who aren't stuck staring at their phone all day.,True
ORD184256,ID0131238689,2019-07-27,Nickolson,"[('iAssist Line', 1), ('pearTV', 2), ('Olivia x460', 2), ('Universe Note', 2)]",24195,64.27,-37.814030100000004,144.9626401,15,20630.02,Winter,False,0.7922,"personally the best phone i've ever used fingerprint reader reads fast, battery life lasts with moderate use well into the day and the unit works very efficiently. the fingerprint's gestures on the s10e are extremely useful.",True
ORD235388,ID0576879075,2019-08-26,Nickolson,"[('Lucent 330S', 2), ('Thunder line', 2)]",6820,64.1,-37.81926729999999,144.9788564,10,6202.1,Winter,False,0.8217,great phone! i am glad i found this phone. everything about it is great. it works well with at&t. the value is amazing.,True
ORD108941,ID0310729981,2019-06-12,Thompson,"[('Universe Note', 1), ('Thunder line', 1)]",5630,64.22,-37.8131411,144.9391035,0,5694.22,Winter,False,0.7024,five stars i have been so happy with this product.,True
