order_id,customer_id,date,nearest_warehouse,shopping_cart,order_price,delivery_charges,customer_lat,customer_long,coupon_discount,order_total,season,is_expedited_delivery,distance_to_nearest_warehouse,latest_customer_review,is_happy_customer
ORD250629,ID0301548223,2019-11-19,Bakers,"[('Lucent 330S', 1), ('pearTV', 2), ('iAssist Line', 2)]",18300,103.25,-37.80651629999999,144.9843136,15,15658.25,Spring,True,1.0354,"three stars no camera, ideal for work",True
ORD291224,ID0248746914,2019-09-03,Bakers,"[('Toshika 750', 1), ('Lucent 330S', 1), ('Candle Inferno', 2), ('Universe Note', 2)]",13310,107.17,-37.821971399999995,144.99403999999996,25,10089.67,Spring,True,1.3372,for the price it's a bargain. this is a perfect solution for a reader and simple browsing. i use this at night before bed.,True
ORD260091,ID5058108351,2019-09-18,Nickolson,"[('Alcon 10', 2), ('pearTV', 1), ('Candle Inferno', 2)]",25070,99.99,-37.82324420000001,144.9687669,10,22662.99,Spring,True,0.5221,five stars works great. i like the quality of the screen.,True
ORD235771,ID4369807452,2019-09-19,Nickolson,"[('Universe Note', 1), ('iStream', 1), ('Lucent 330S', 2), ('Thunder line', 2)]",10420,99.18,-37.813712100000004,144.97210859999996,15,8956.18,Spring,True,0.5882,y2k you have a good battery life the camera is great as well and use it for work,True
ORD337663,ID0582560124,2019-10-07,Nickolson,"[('Universe Note', 2), ('Thunder line', 2)]",11260,101.28,-37.82218510000001,144.9786566,10,10235.28,Spring,True,0.8949,this is outstanding works awesome the music sound very clear and loud and iassist is very smart,True
ORD287469,ID6167417924,2019-10-21,Thompson,"[('Toshika 750', 1), ('Lucent 330S', 1)]",5550,104.5,-37.8158559,144.9571644,25,4267.0,Spring,True,0.9559,love this phone packaged great. i also got a 64gb memory catd with it and i ansolutely love my phone. it uses 2 sim plus a memory card. great phone,True
ORD294793,ID0030221048,2019-11-06,Bakers,"[('Candle Inferno', 1), ('Toshika 750', 2)]",9070,110.21,-37.8122155,145.01596730000003,0,9180.21,Spring,True,1.8402,"perfect little phone i got this phone for my mom who lives abroad, but needs a phone when she visits me. prepaid phone is so convenient, this phone is so slim, and easy to use. if you are looking for the basic function of calling and texting, this is perfect.",True
ORD418292,ID6131956011,2019-10-05,Nickolson,"[('Thunder line', 1), ('iStream', 2), ('iAssist Line', 1), ('Toshika 750', 1)]",9025,103.65,-37.8252459,144.9806127,10,8226.15,Spring,True,1.2224,she loves it!! got this as a gift for my girl few months ago. she still loves it.,True
ORD308968,ID0655124685,2019-10-21,Thompson,"[('pearTV', 1), ('iStream', 1), ('Candle Inferno', 2)]",7320,96.73,-37.8081494,144.9426014,25,5586.73,Spring,True,0.6387,five stars worked perfect,True
ORD416602,ID3394726515,2019-09-07,Nickolson,"[('iStream', 1), ('Olivia x460', 2), ('Toshika 750', 2)]",11240,101.12,-37.817050099999996,144.96158390000005,15,9655.12,Spring,True,0.7214,"excellent product absolutely new, just no earphones came in the box",True
ORD164176,ID1327054103,2019-10-27,Nickolson,"[('Toshika 750', 1), ('pearTV', 2), ('iAssist Line', 2), ('iStream', 2)]",21690,99.21,-37.81336870000001,144.9650409,10,19620.21,Spring,True,0.7041,great purchase very good product,True
ORD441719,ID1900213543,2019-10-24,Thompson,"[('Alcon 10', 2), ('Thunder line', 1)]",20080,106.14,-37.806558,144.96148440000005,25,15166.14,Spring,True,1.439,i love it i love it. the phone is a little to big to go into your pants pocket but the phone is a good size to see or to hold in your hands.,True
ORD419960,ID0111295073,2019-10-30,Nickolson,"[('Olivia x460', 2), ('Thunder line', 2)]",6810,101.23,-37.823192799999994,144.960834,15,5889.73,Spring,True,0.9217,perfect bought this phone for my dad and the fact that i love it means he's gonna love it... the phone offers so much for its price...,True
ORD230487,ID2269263377,2019-09-23,Thompson,"[('Toshika 750', 2), ('Universe Note', 1)]",12090,101.13,-37.8191715,144.9542421,5,11586.63,Spring,True,0.9598,"great bang for the buck very nice phone, only drawback would be the camera, but considering the price it is understandable i replaced my old alcon 6s with this phone, and using it mainly as a bussines oriented tool, i'm happy with the change",True
ORD128775,ID4746121968,2019-09-29,Nickolson,"[('Universe Note', 2), ('Alcon 10', 2), ('Olivia x460', 1), ('pearTV', 2)]",38645,101.72,-37.812325799999996,144.9735736,15,32949.97,Spring,True,0.7824,very happy excellent phone not a scratch works great battery great just put sim in and was all set delivery was right on time would recommend this company will buy again,True
ORD317303,ID0310729981,2019-11-06,Thompson,"[('Alcon 10', 1), ('Toshika 750', 2)]",17590,101.04,-37.8131411,144.9391035,15,15052.54,Spring,True,0.7024,amazing! this phone is just amazing! comes quickly and definitely is the best olivia smartphone!,True
ORD311818,ID0452381000,2019-11-30,Thompson,"[('Alcon 10', 1), ('Thunder line', 2)]",13310,105.18,-37.8252684,144.9505753,0,13415.18,Spring,True,1.4356,i purchased it for my friend and he love it. it has money value for the price. i purchased it for my friend and he love it.,True
ORD266947,ID4518639882,2019-10-23,Thompson,"[('Candle Inferno', 1), ('iAssist Line', 2), ('pearTV', 1)]",11190,99.16,-37.8074934,144.9421545,5,10729.66,Spring,True,0.7206,"not for north america great phone, brand new, the only problem was the ac plug was for uk, not north america which i thought was strange at first, especially since it wasn't mentioned.",True
ORD024797,ID3394728757,2019-09-29,Nickolson,"[('Toshika 750', 1), ('Alcon 10', 2)]",22220,103.18,-37.8197751,144.9599386,25,16768.18,Spring,True,0.8554,it is work perfectly it is work perfectly,True
ORD377409,ID2670903130,2019-11-01,Thompson,"[('Olivia x460', 1), ('Candle Inferno', 1)]",1655,109.12,-37.803444899999995,144.9628053,5,1681.37,Spring,True,1.7236,"best bang for the bug pros: good facial recognition better than my coworker alcon xr, fast, cheap cons: lucent voice not working, battery drains out fast especially when no wifi",True
ORD055728,ID0576860018,2019-11-25,Bakers,"[('Thunder line', 2), ('Candle Inferno', 2)]",5220,108.27,-37.8247819,144.9888576,5,5067.27,Spring,True,1.7387,but still think the s4 is a great phone cancelled my order so never used this phone. but still think the s4 is a great phone,True
ORD413352,ID0582563607,2019-10-11,Nickolson,"[('Alcon 10', 2), ('iStream', 2), ('Olivia x460', 1)]",19425,100.98,-37.8218974,144.9777275,0,19525.98,Spring,True,0.8075,great phone i love my new phone. it looks great for used good s7. only issue is battery is draining faster than should but i can deal with that. thx. 😀😀😀,True
ORD284809,ID3924911404,2019-11-08,Nickolson,"[('iStream', 2), ('Thunder line', 1)]",2480,96.86,-37.8133298,144.96549950000005,5,2452.86,Spring,True,0.6859,amazing for the price this phone is amazing for the price!! love the big screen and facial recognition,True
ORD165313,ID0355818836,2019-11-10,Bakers,"[('iAssist Line', 2), ('Lucent 330S', 2), ('Universe Note', 1), ('Thunder line', 2)]",14720,96.03,-37.81013770000001,144.9965834,5,14080.03,Spring,True,0.1199,loving it love it. best android device there is. my only gripe is the battery life but i can overlook that as the rest of the phone is amazing.,True
ORD327598,ID1833115017,2019-09-30,Thompson,"[('pearTV', 1), ('Thunder line', 2), ('iAssist Line', 1)]",12895,100.19,-37.8122934,144.9540216,0,12995.19,Spring,True,0.6129,four stars very happy with my perches,True
ORD130886,ID0060095899,2019-11-09,Bakers,"[('Alcon 10', 1), ('Olivia x460', 1), ('Thunder line', 1)]",12355,103.61,-37.8174653,144.99007869999997,0,12458.61,Spring,True,0.9469,"unlocked for any carrier phone was in brand new condition. just phone and stylus, no charger or any other accessories. was very good deal.",True
ORD220783,ID0711778933,2019-09-03,Thompson,"[('pearTV', 1), ('iStream', 2), ('Thunder line', 1), ('Alcon 10', 1)]",17740,96.87,-37.8149035,144.9459165,25,13401.87,Spring,True,0.2682,"great phone i really like this phone! it has all the features i wanted. the battery life could be a little longer but it is ok. and, it was a good buy at the price.",True
ORD023635,ID2481930665,2019-11-08,Bakers,"[('Toshika 750', 2), ('iStream', 2), ('Candle Inferno', 1)]",9370,75.91,-37.8103255,145.0019927,25,7103.41,Spring,False,0.5957,"great phone all works well fast, reliable and it works great",True
ORD109045,ID0581704634,2019-09-08,Thompson,"[('Toshika 750', 1), ('iAssist Line', 2), ('iStream', 2)]",9070,81.99,-37.8166412,144.9316921,5,8698.49,Spring,False,1.4226,"love it!! i love my new phone. brand new, in an unopened box just as discredit.",True
ORD487205,ID4638961336,2019-11-17,Thompson,"[('Candle Inferno', 1), ('Thunder line', 2), ('Alcon 10', 1)]",13740,73.07,-37.8096152,144.9462169,25,10378.07,Spring,False,0.3486,absolutely love the tablet. my wife loves it. much more enjoyable than playing on the phone.,True
ORD424089,ID0591428011,2019-10-09,Nickolson,"[('Thunder line', 2), ('Candle Inferno', 2), ('Lucent 330S', 1), ('iStream', 2)]",6750,74.41,-37.8179891,144.9620086,15,5811.91,Spring,False,0.6667,better and cheaper than alcon 6 so far so good from march 2019,True
ORD498095,ID0277517044,2019-10-21,Thompson,"[('Olivia x460', 1), ('Lucent 330S', 2), ('Alcon 10', 2), ('iStream', 2)]",21885,81.28,-37.8071876,144.9590913,5,20872.03,Spring,False,1.2209999999999999,five stars love this phone!!!! i have dropped and tossed it. it's like any phone u still have to be careful with it. my boyfriend has that indestructible phone(not olivia) the screen did not break but the phone did!!,True
ORD234071,ID6167413253,2019-11-21,Nickolson,"[('pearTV', 1), ('iAssist Line', 2), ('Candle Inferno', 1)]",11190,75.54,-37.8128633,144.96829590000004,0,11265.54,Spring,False,0.6475,love it everything best phone,True
ORD120562,ID0634778969,2019-11-14,Thompson,"[('Toshika 750', 1), ('Thunder line', 2)]",8680,77.45,-37.8133482,144.9377959,10,7889.45,Spring,False,0.8189,charger does not work recieved with no good charger,True
ORD083675,ID0579494469,2019-10-12,Thompson,"[('Alcon 10', 2), ('Olivia x460', 1), ('Candle Inferno', 1), ('iStream', 2)]",19855,74.39,-37.815894899999996,144.95088230000005,0,19929.39,Spring,False,0.491,she loves it bought this for my sister. she loves it. takes great pix,True
ORD398813,ID0711333376,2019-09-05,Thompson,"[('Toshika 750', 2), ('Thunder line', 1), ('Universe Note', 2), ('Candle Inferno', 1)]",18150,77.9,-37.8066038,144.9560351,0,18227.9,Spring,False,1.0384,five stars best phone i've ever owned. way underrated. a top pick.,True
ORD237124,ID0317535757,2019-11-29,Nickolson,"[('Olivia x460', 1), ('iStream', 2)]",1525,82.08,-37.8064746,144.9651665,10,1454.58,Spring,False,1.4032,"i love my phone is a beautiful phone and very high quality, i used to have an alcon and i'm not missing it. working fast and good so far. excellent transaction, very recomended.",True
ORD300619,ID1479905329,2019-09-20,Nickolson,"[('Olivia x460', 1), ('Toshika 750', 1), ('pearTV', 2)]",18165,80.65,-37.821130200000006,144.9577365,5,17337.4,Spring,False,1.0765,"unlocked phone unlocked phone, good to have.",True
ORD316412,ID0255059521,2019-11-16,Nickolson,"[('pearTV', 2), ('iStream', 1), ('Thunder line', 2), ('Alcon 10', 1)]",26080,75.99,-37.812584,144.97261569999995,10,23547.99,Spring,False,0.7214,"five stars amazing phone! with some minor scratches, but working good. couldn't be more satisfied!",True
ORD450671,ID1545387671,2019-11-30,Thompson,"[('Lucent 330S', 1), ('Candle Inferno', 2), ('Thunder line', 1)]",4270,83.34,-37.8009705,144.95670619999999,15,3712.84,Spring,False,1.5542,five stars best the shipping was good the phone works well thank you guys,True
ORD027164,ID2613024047,2019-10-02,Thompson,"[('Alcon 10', 2), ('Candle Inferno', 2), ('Lucent 330S', 1)]",19990,71.18,-37.8146901,144.94662730000005,10,18062.18,Spring,False,0.2278,reliable needed it for work. it was awesome,True
ORD154213,ID2180785582,2019-09-03,Nickolson,"[('iStream', 2), ('pearTV', 2), ('Candle Inferno', 1), ('iAssist Line', 2)]",17800,76.35,-37.81684,144.96164119999997,10,16096.35,Spring,False,0.7225,liked the phone but didn't work out for me returned. i purchased a cell booster so we could have cell phone service but did not work here. liked the phone but didn't work out for me.,True
ORD497759,ID1458422297,2019-09-16,Bakers,"[('pearTV', 1), ('Thunder line', 1), ('iStream', 2), ('Alcon 10', 2)]",26690,81.37,-37.817938700000006,145.00853,5,25436.87,Spring,False,1.4661,five stars great phone works perfectly looks new,True
ORD073367,ID1479905329,2019-11-21,Nickolson,"[('iAssist Line', 1), ('Toshika 750', 2)]",10865,80.56,-37.821130200000006,144.9577365,10,9859.06,Spring,False,1.0765,"great phone! i am very happy with the efficient great phone! i am very happy with the efficient, fast performance. beautiful camera, nice screen. i am very pleased with this phone.",True
ORD228434,ID0703556756,2019-09-13,Thompson,"[('pearTV', 1), ('Lucent 330S', 1), ('iAssist Line', 2)]",11990,79.48,-37.8067213,144.9560456,15,10270.98,Spring,False,1.0306,talk able good,True
ORD302198,ID0774498096,2019-11-14,Thompson,"[('Alcon 10', 1), ('iAssist Line', 1), ('Universe Note', 1), ('Lucent 330S', 1)]",15855,78.85,-37.8088685,144.95809419999995,0,15933.85,Spring,False,1.0581,slow processor i had a universe j7 2017 version. this phone does not compare! the processor is definitely much slower. it is a note 3/ means 2013 duhhh... so this is what you get when you purchase a phone that was manufactured in 2013. i still love olivia's though...,True
ORD069263,ID0576874718,2019-11-01,Bakers,"[('Toshika 750', 1), ('Olivia x460', 1)]",5545,83.99,-37.823242,144.9881207,10,5074.49,Spring,False,1.6016,great product fro an older phone my wife has the s9 prior to losing it. she loves the camera but can not stand the battery life.,True
ORD298257,ID4909776698,2019-10-24,Bakers,"[('Toshika 750', 1), ('pearTV', 1), ('iStream', 2), ('Alcon 10', 2)]",28830,83.49,-37.8240439,144.999828,0,28913.49,Spring,False,1.6151,"condition ok. not excellent. this phone was supposed to be in excellent condition. the pen is broken. and the silver along the sides is all dinged up and dented. but over all phone works good, and you got me to buy something else from your site because now i have to order a new pen.",True
ORD083881,ID0245537622,2019-10-24,Nickolson,"[('Lucent 330S', 2), ('Candle Inferno', 1)]",2890,77.18,-37.8108376,144.96556,5,2822.68,Spring,False,0.9321,great phone great phone no issues,True
ORD253792,ID0206204625,2019-10-01,Thompson,"[('Lucent 330S', 1), ('Alcon 10', 1), ('Toshika 750', 1)]",14500,83.02,-37.8207271,144.9318429,10,13133.02,Spring,False,1.6114,four stars love it,True
ORD227123,ID6221450544,2019-11-09,Bakers,"[('Universe Note', 2), ('Olivia x460', 1), ('Thunder line', 1)]",10305,78.53,-37.80879820000001,144.98301809999995,25,7807.28,Spring,False,1.0824,"i don't recommend because of dropping calls worked fine for awhile,now drops calls or cant connect to the network. phone carrier says not a problem on their end.",True
ORD470713,ID6231506318,2019-10-01,Nickolson,"[('Candle Inferno', 2), ('Universe Note', 2), ('pearTV', 1)]",14070,74.61,-37.824267600000006,144.970044,0,14144.61,Spring,False,0.6329,5 everything is very good,True
ORD249519,ID0144720457,2019-09-27,Nickolson,"[('pearTV', 1), ('iStream', 1)]",6460,77.56,-37.8199049,144.956864,10,5891.56,Spring,False,1.1251,five stars good deal,True
ORD202869,ID0250933623,2019-09-26,Bakers,"[('Lucent 330S', 1), ('Toshika 750', 1), ('Thunder line', 1)]",7730,82.34,-37.82275170000001,145.0039638,10,7039.34,Spring,False,1.6142,4 out of 5 not a bad phone. enjoyed my optimus 2 a little more to be honest but the phone is nice. con's are the battery life is pretty bad if you play any games or surf the web. usually dies shortly after 8 hour work day.,True
ORD180443,ID0036824725,2019-11-02,Thompson,"[('pearTV', 1), ('Olivia x460', 1), ('Thunder line', 1), ('Lucent 330S', 2)]",12175,78.46,-37.824657200000004,144.94309040000005,25,9209.71,Spring,False,1.3791,get one too!!! the phone is amazing! great quality and an awesome price,True
ORD415114,ID0054552159,2019-09-01,Nickolson,"[('Lucent 330S', 2), ('Thunder line', 1), ('pearTV', 2)]",17260,80.66,-37.8210362,144.98375249999995,25,13025.66,Spring,False,1.278,"three stars ok for the money, but need more memory on it.",True
ORD487487,ID0250933656,2019-10-21,Bakers,"[('Thunder line', 1), ('Toshika 750', 1), ('Lucent 330S', 1), ('pearTV', 2)]",20350,84.54,-37.8252603,145.0004236,5,19417.04,Spring,False,1.7594,enjoy the multifaceted opportunities that are available with the candle,True
ORD018468,ID0030943324,2019-10-27,Thompson,"[('Universe Note', 2), ('iAssist Line', 1), ('Toshika 750', 1), ('pearTV', 1)]",19755,81.06,-37.8037706,144.9564762,15,16872.81,Spring,False,1.291,four stars i love it,True
ORD214981,ID0287630673,2019-11-29,Thompson,"[('Thunder line', 1), ('pearTV', 2), ('Toshika 750', 1)]",19120,76.99,-37.803644399999996,144.9459766,5,18240.99,Spring,False,1.0096,"packaging was great, but phone itself had glitch in led screen ... packaging was great, but phone itself had glitch in led screen and small gash. but functional. need a phone now so don't have time to get it changed. just going to deal with it",True
ORD427544,ID2935371923,2019-09-19,Bakers,"[('Thunder line', 2), ('iStream', 1), ('Lucent 330S', 2), ('pearTV', 1)]",13280,83.13,-37.8251249,144.99199380000005,10,12035.13,Spring,False,1.7080000000000002,nice phone with plenty of power and great features definitely a step up over budget phones i am used to having. took one star off for all the built in mi apps and advertisements that come with it... can replace most of them with google apps if you want to avoid their cloud,True
ORD277149,ID6167191180,2019-11-29,Thompson,"[('Universe Note', 2), ('iStream', 2), ('Candle Inferno', 1), ('Alcon 10', 1)]",16580,79.8,-37.8182748,144.9565053,5,15830.8,Spring,False,1.038,ha muy bueno,True
ORD297207,ID0589397643,2019-11-14,Nickolson,"[('Alcon 10', 2), ('pearTV', 2), ('iStream', 2)]",30820,74.44,-37.8125168,144.97400969999995,5,29353.44,Spring,False,0.782,four stars small screen but fits in hand and is not slippery. the camera provides high picture clarity.,True
ORD085605,ID4245791605,2019-09-16,Thompson,"[('Candle Inferno', 2), ('Lucent 330S', 1)]",2090,85.07,-37.8012266,144.96241559999999,15,1861.57,Spring,False,1.8562,"it's great this phone is awesome, had it for about 6 months and haven't had a single problem with it so far. albeit i'm not on my phone all the time but i'm still on it a decent amount. great size, great style, great video and pictures, great functionality, great system and just all around...great!",True
ORD280108,ID3204395230,2019-09-09,Thompson,"[('Candle Inferno', 1), ('Olivia x460', 2), ('Lucent 330S', 2), ('iStream', 2)]",5640,74.04,-37.807594200000004,144.9479726,25,4304.04,Spring,False,0.5709,great product this was my mom's first smartphone (she recently upgraded from a cosmos 3). excellent starter phone for someone who is just getting used to a smartphone.,True
ORD428351,ID0206204625,2019-10-03,Thompson,"[('Toshika 750', 1), ('Universe Note', 1), ('Lucent 330S', 2)]",10230,82.96,-37.8207271,144.9318429,25,7755.46,Spring,False,1.6114,very nice phone for the money very nice! i picked this up for my girl. i like it a lot ! charges fast has a lot of memory and it’s good with mobile video games. after the update seems faster and the camera gallery fixed along with other apps maybe going to buy the new one later for me self.,True
ORD491408,ID3983269230,2019-10-01,Bakers,"[('Candle Inferno', 2), ('Olivia x460', 1), ('Thunder line', 2)]",6445,80.08,-37.8209233,144.9881771,0,6525.08,Spring,False,1.3655,"this was a great phone 2 years ago before the serious applications time has gone by, and this phone is not living up to the pressures of today. this was a great phone 2 years ago before the serious applications. you will be missed.",True
ORD192806,ID0233314845,2019-11-30,Nickolson,"[('Candle Inferno', 2), ('iStream', 2)]",1160,83.15,-37.8050795,144.9745234,15,1069.15,Spring,False,1.5668,love the tv/movie selection. i really like the fact that i can just rent a movie if they don't have it in their selection.,True
ORD184516,ID4655086242,2019-09-02,Thompson,"[('Thunder line', 1), ('pearTV', 2), ('Toshika 750', 2)]",23440,69.91,-37.810750399999996,144.94589919999999,25,17649.91,Spring,False,0.2375,excellent features and quality...olivia has improved with this phone. liked the ease of face recognition which worked even in dim light. faster and more features than the previous olivia universe phones and a sleek design. price is a little high but so worth it.,True
ORD413765,ID6167489497,2019-11-01,Nickolson,"[('Lucent 330S', 2), ('Thunder line', 2), ('Olivia x460', 2)]",9270,74.93,-37.81899620000001,144.9627055,15,7954.43,Spring,False,0.6036,five stars nice!,True
ORD031795,ID0310957682,2019-11-20,Thompson,"[('Candle Inferno', 1), ('Lucent 330S', 1)]",1660,83.19,-37.8217368,144.93069509999995,5,1660.19,Spring,False,1.7582,works great the phone works great and my daughter loves it.,True
ORD026867,ID2462381375,2019-11-09,Thompson,"[('Olivia x460', 1), ('Alcon 10', 2)]",19125,85.98,-37.799825,144.9639739,25,14429.73,Spring,False,2.063,five stars it's very good phone. i love it so mush!!!,True
ORD379000,ID3215191973,2019-11-07,Thompson,"[('Thunder line', 2), ('Universe Note', 2), ('Alcon 10', 1)]",20210,79.18,-37.807521799999996,144.9554757,15,17257.68,Spring,False,0.9357,hits the spot did have some small bugs at first and the system ui can take a while to get used to but it’s worth it for the money specs are great,True
ORD071272,ID1459448707,2019-11-16,Bakers,"[('Toshika 750', 1), ('iStream', 1)]",4470,80.81,-37.81948120000001,145.00771880000005,25,3433.31,Spring,False,1.5234,love it! i love my new i phone.,True
ORD307194,ID2384091376,2019-10-26,Nickolson,"[('Candle Inferno', 1), ('Thunder line', 2), ('iStream', 2)]",5090,79.7,-37.8077129,144.9732421,0,5169.7,Spring,False,1.2541,five stars excelent product is the best,True
ORD431851,ID0579506494,2019-09-20,Thompson,"[('iStream', 1), ('pearTV', 2)]",12770,72.5,-37.8135387,144.9481638,5,12204.0,Spring,False,0.1362,cost effective good one,True
ORD250480,ID1463547022,2019-09-06,Bakers,"[('pearTV', 2), ('Toshika 750', 2), ('Candle Inferno', 2)]",22120,79.65,-37.81897100000001,145.0038358,25,16669.65,Spring,False,1.2532,4 stars phone is incredible. only issue is it will freeze up every once in a while and have to take the battery out and put it back on,True
ORD053846,ID0844489477,2019-11-26,Thompson,"[('iStream', 1), ('pearTV', 1), ('Alcon 10', 2), ('Lucent 330S', 1)]",25590,77.79,-37.8209007,144.9476645,0,25667.79,Spring,False,0.9174,five stars very nice lucentrola cell phone,True
ORD321489,ID0846570962,2019-09-27,Nickolson,"[('Candle Inferno', 2), ('Alcon 10', 1), ('Lucent 330S', 2), ('Thunder line', 2)]",16630,69.57,-37.8185289,144.97011080000001,15,14205.07,Spring,False,0.0498,"it works perfectly it's completely unlocked , it works perfectly,i ordered it with standard shipping and they delivered it two days before i expected!! 🤩",True
ORD485771,ID3161949474,2019-10-20,Thompson,"[('iAssist Line', 2), ('Lucent 330S', 2), ('iStream', 1), ('Candle Inferno', 1)]",7490,88.53,-37.80803020000001,144.9572923,15,6455.03,Spring,True,1.0371,volume is so bad very low volume and speaker sound is also bad,False
ORD324153,ID0576818194,2019-11-25,Nickolson,"[('Toshika 750', 1), ('iStream', 1), ('Thunder line', 2), ('iAssist Line', 2)]",13280,91.87,-37.8238387,144.9835918,10,12043.87,Spring,True,1.3657,... they were certified refurbished and it said new not happy at all i ordered 2 of these phones for me and my wife payed 285 a pice for brand new neither phone charging port worked had to buy wireless chargers to charge them and the were not brand new they were certified refurbished and it said new not happy at all,False
ORD449658,ID0363400141,2019-10-09,Thompson,"[('Thunder line', 2), ('Universe Note', 2), ('pearTV', 1), ('Lucent 330S', 2)]",20030,96.23,-37.799546299999996,144.96284450000005,10,18123.23,Spring,True,2.015,should say at&t and sprint what phone should be advertised is at&t and sprint cuz when you google it it shows up you ask verizon,False
ORD249332,ID0702373605,2019-11-17,Thompson,"[('Thunder line', 2), ('Lucent 330S', 2)]",6820,85.97,-37.8074024,144.9423104,0,6905.97,Spring,True,0.7207,stopped working within a month. stopped working within a month. the person i gave it too didn't tell me in time to return it,False
ORD413326,ID4419686652,2019-11-30,Thompson,"[('iStream', 1), ('Thunder line', 1), ('Alcon 10', 1)]",11280,93.36,-37.8031484,144.9620726,25,8553.36,Spring,True,1.6927,useless useless!! phone is useless!!!,False
ORD234803,ID0710013192,2019-10-31,Thompson,"[('Lucent 330S', 2), ('Candle Inferno', 1)]",2890,91.34,-37.8170276,144.9324375,5,2836.84,Spring,True,1.375,we are unable to connect wifi on this product. we have tried to follow the instructions to no avail. it is a useless and expensive item sitting on our table.,False
ORD146148,ID0151452170,2019-09-23,Bakers,"[('iStream', 1), ('Thunder line', 2), ('Olivia x460', 1), ('Universe Note', 2)]",12635,88.42,-37.79835670000001,144.99801230000003,5,12091.67,Spring,True,1.3185,be aware it is not unlocked it was not unlocked. tried different networks but it didn't work,False
ORD459377,ID0844495918,2019-10-04,Thompson,"[('Universe Note', 1), ('Toshika 750', 1), ('Thunder line', 1)]",9950,87.03,-37.8195394,144.95269309999995,0,10037.03,Spring,True,0.9104,one star no sim card,False
ORD410931,ID0291211340,2019-09-13,Thompson,"[('Lucent 330S', 1), ('Toshika 750', 2), ('Thunder line', 2)]",14230,90.01,-37.8088956,144.9608977,0,14320.01,Spring,True,1.2868,locked att phone. useless to me the phone is locked. i am not an at&t customer so the phone is useless to me,False
